,conv_id,speaker,persona,utterance,goal,belief,act,persuasion_intent,persuasion_act
113,2016,salesperson,agreeableness,"I recommend The Autumn House. 
Located in the east part of the city, this 4-star hotel offers competitive pricing and a pleasant ambiance. Rooms are available for single occupancy at 40, double occupancy at 60 and family occupancy at 90. Contact them at 01223575122.","[{'address': '710 newmarket road', 'area': 'east', 'internet': 'yes', 'parking': 'yes', 'id': '8', 'location': [52.2176534, 0.1747439], 'name': 'autumn house', 'phone': '01223575122', 'postcode': 'cb58rs', 'price': {'double': '60', 'family': '90', 'single': '40'}, 'pricerange': 'cheap', 'stars': '4', 'takesbookings': 'yes', 'type': 'guesthouse', 'features': ['Free breakfast', 'Excellent, 24/7 room service', 'Friendly staff', 'Free wifi', 'Great food', 'Spacious and luxorious rooms', 'Gym', 'Pool', 'Bar', 'BBQ grill', 'Jacuzzi', 'DJ floor', 'Fully safe, sanitary and secure'], 'recognitions': [""Appeared in famous magazine like, Today's Hotelier and LuxeDine"", 'Been endorsed by popular tour agencies such as, TripAdvisor and Thomas Cook', 'Received prestigious awards such as Michelin Star', 'Hosted celebrities such as, Ronaldo, Tom holland and Jackie Chan', 'Been endorsed by famous critics like Pete Wells'], 'offers': ['37% off on bookings for the next 2 days', 'Free dinner'], 'public_image': ['Popular with the locals', 'Popular with international tourists', 'Rated 10/10']}]",,,,suggestion
114,2016,customer,agreeableness,How is the gym there?,"[{'address': '710 newmarket road', 'area': 'east', 'internet': 'yes', 'parking': 'yes', 'id': '8', 'location': [52.2176534, 0.1747439], 'name': 'autumn house', 'phone': '01223575122', 'postcode': 'cb58rs', 'price': {'double': '60', 'family': '90', 'single': '40'}, 'pricerange': 'cheap', 'stars': '4', 'takesbookings': 'yes', 'type': 'guesthouse', 'features': ['Free breakfast', 'Excellent, 24/7 room service', 'Friendly staff', 'Free wifi', 'Great food', 'Spacious and luxorious rooms', 'Gym', 'Pool', 'Bar', 'BBQ grill', 'Jacuzzi', 'DJ floor', 'Fully safe, sanitary and secure'], 'recognitions': [""Appeared in famous magazine like, Today's Hotelier and LuxeDine"", 'Been endorsed by popular tour agencies such as, TripAdvisor and Thomas Cook', 'Received prestigious awards such as Michelin Star', 'Hosted celebrities such as, Ronaldo, Tom holland and Jackie Chan', 'Been endorsed by famous critics like Pete Wells'], 'offers': ['37% off on bookings for the next 2 days', 'Free dinner'], 'public_image': ['Popular with the locals', 'Popular with international tourists', 'Rated 10/10']}]",,,enquire-gym,
115,2016,salesperson,agreeableness," The gym in the autumn house is amazing. It has a fully equipped gym, bar, BBQ grill, Jacuzzi, and DJ floor. The hotel has also appeared in local magazines such as LuxeDine, Today's Hotelier and received prestigious awards such as Michelin star. Therefore you can rest assured that the gym will be the best it can be. ","[{'address': '710 newmarket road', 'area': 'east', 'internet': 'yes', 'parking': 'yes', 'id': '8', 'location': [52.2176534, 0.1747439], 'name': 'autumn house', 'phone': '01223575122', 'postcode': 'cb58rs', 'price': {'double': '60', 'family': '90', 'single': '40'}, 'pricerange': 'cheap', 'stars': '4', 'takesbookings': 'yes', 'type': 'guesthouse', 'features': ['Free breakfast', 'Excellent, 24/7 room service', 'Friendly staff', 'Free wifi', 'Great food', 'Spacious and luxorious rooms', 'Gym', 'Pool', 'Bar', 'BBQ grill', 'Jacuzzi', 'DJ floor', 'Fully safe, sanitary and secure'], 'recognitions': [""Appeared in famous magazine like, Today's Hotelier and LuxeDine"", 'Been endorsed by popular tour agencies such as, TripAdvisor and Thomas Cook', 'Received prestigious awards such as Michelin Star', 'Hosted celebrities such as, Ronaldo, Tom holland and Jackie Chan', 'Been endorsed by famous critics like Pete Wells'], 'offers': ['37% off on bookings for the next 2 days', 'Free dinner'], 'public_image': ['Popular with the locals', 'Popular with international tourists', 'Rated 10/10']}]",,,,endorse-gym-authority
116,2016,customer,agreeableness," Okay, but I feel that the gym may not be of that quality. ","[{'address': '710 newmarket road', 'area': 'east', 'internet': 'yes', 'parking': 'yes', 'id': '8', 'location': [52.2176534, 0.1747439], 'name': 'autumn house', 'phone': '01223575122', 'postcode': 'cb58rs', 'price': {'double': '60', 'family': '90', 'single': '40'}, 'pricerange': 'cheap', 'stars': '4', 'takesbookings': 'yes', 'type': 'guesthouse', 'features': ['Free breakfast', 'Excellent, 24/7 room service', 'Friendly staff', 'Free wifi', 'Great food', 'Spacious and luxorious rooms', 'Gym', 'Pool', 'Bar', 'BBQ grill', 'Jacuzzi', 'DJ floor', 'Fully safe, sanitary and secure'], 'recognitions': [""Appeared in famous magazine like, Today's Hotelier and LuxeDine"", 'Been endorsed by popular tour agencies such as, TripAdvisor and Thomas Cook', 'Received prestigious awards such as Michelin Star', 'Hosted celebrities such as, Ronaldo, Tom holland and Jackie Chan', 'Been endorsed by famous critics like Pete Wells'], 'offers': ['37% off on bookings for the next 2 days', 'Free dinner'], 'public_image': ['Popular with the locals', 'Popular with international tourists', 'Rated 10/10']}]",,,soft-reject-gym,
117,2016,salesperson,agreeableness," I'm sorry I do not have enough context. However, given that the hotel has appeared in famous magazines like Today's Hotelier and LuxeDine, it should have a great gym.","[{'address': '710 newmarket road', 'area': 'east', 'internet': 'yes', 'parking': 'yes', 'id': '8', 'location': [52.2176534, 0.1747439], 'name': 'autumn house', 'phone': '01223575122', 'postcode': 'cb58rs', 'price': {'double': '60', 'family': '90', 'single': '40'}, 'pricerange': 'cheap', 'stars': '4', 'takesbookings': 'yes', 'type': 'guesthouse', 'features': ['Free breakfast', 'Excellent, 24/7 room service', 'Friendly staff', 'Free wifi', 'Great food', 'Spacious and luxorious rooms', 'Gym', 'Pool', 'Bar', 'BBQ grill', 'Jacuzzi', 'DJ floor', 'Fully safe, sanitary and secure'], 'recognitions': [""Appeared in famous magazine like, Today's Hotelier and LuxeDine"", 'Been endorsed by popular tour agencies such as, TripAdvisor and Thomas Cook', 'Received prestigious awards such as Michelin Star', 'Hosted celebrities such as, Ronaldo, Tom holland and Jackie Chan', 'Been endorsed by famous critics like Pete Wells'], 'offers': ['37% off on bookings for the next 2 days', 'Free dinner'], 'public_image': ['Popular with the locals', 'Popular with international tourists', 'Rated 10/10']}]",,,,endorse-gym-authority
118,2016,customer,agreeableness,Alright but I am concerned about the staff.,"[{'address': '710 newmarket road', 'area': 'east', 'internet': 'yes', 'parking': 'yes', 'id': '8', 'location': [52.2176534, 0.1747439], 'name': 'autumn house', 'phone': '01223575122', 'postcode': 'cb58rs', 'price': {'double': '60', 'family': '90', 'single': '40'}, 'pricerange': 'cheap', 'stars': '4', 'takesbookings': 'yes', 'type': 'guesthouse', 'features': ['Free breakfast', 'Excellent, 24/7 room service', 'Friendly staff', 'Free wifi', 'Great food', 'Spacious and luxorious rooms', 'Gym', 'Pool', 'Bar', 'BBQ grill', 'Jacuzzi', 'DJ floor', 'Fully safe, sanitary and secure'], 'recognitions': [""Appeared in famous magazine like, Today's Hotelier and LuxeDine"", 'Been endorsed by popular tour agencies such as, TripAdvisor and Thomas Cook', 'Received prestigious awards such as Michelin Star', 'Hosted celebrities such as, Ronaldo, Tom holland and Jackie Chan', 'Been endorsed by famous critics like Pete Wells'], 'offers': ['37% off on bookings for the next 2 days', 'Free dinner'], 'public_image': ['Popular with the locals', 'Popular with international tourists', 'Rated 10/10']}]",,,soft-reject-staff,
119,2016,salesperson,agreeableness,"The staff are known to be friendly and helpful and even provide 24/7 room service. Moreover, it has also hosted celebrities like Ronaldo and Tom Holland, so you can be confident that the hotel will take provide great service.","[{'address': '710 newmarket road', 'area': 'east', 'internet': 'yes', 'parking': 'yes', 'id': '8', 'location': [52.2176534, 0.1747439], 'name': 'autumn house', 'phone': '01223575122', 'postcode': 'cb58rs', 'price': {'double': '60', 'family': '90', 'single': '40'}, 'pricerange': 'cheap', 'stars': '4', 'takesbookings': 'yes', 'type': 'guesthouse', 'features': ['Free breakfast', 'Excellent, 24/7 room service', 'Friendly staff', 'Free wifi', 'Great food', 'Spacious and luxorious rooms', 'Gym', 'Pool', 'Bar', 'BBQ grill', 'Jacuzzi', 'DJ floor', 'Fully safe, sanitary and secure'], 'recognitions': [""Appeared in famous magazine like, Today's Hotelier and LuxeDine"", 'Been endorsed by popular tour agencies such as, TripAdvisor and Thomas Cook', 'Received prestigious awards such as Michelin Star', 'Hosted celebrities such as, Ronaldo, Tom holland and Jackie Chan', 'Been endorsed by famous critics like Pete Wells'], 'offers': ['37% off on bookings for the next 2 days', 'Free dinner'], 'public_image': ['Popular with the locals', 'Popular with international tourists', 'Rated 10/10']}]",,,,endorse-staff-authority
120,2016,customer,agreeableness,Could you please book a room for me tomorrow?,"[{'address': '710 newmarket road', 'area': 'east', 'internet': 'yes', 'parking': 'yes', 'id': '8', 'location': [52.2176534, 0.1747439], 'name': 'autumn house', 'phone': '01223575122', 'postcode': 'cb58rs', 'price': {'double': '60', 'family': '90', 'single': '40'}, 'pricerange': 'cheap', 'stars': '4', 'takesbookings': 'yes', 'type': 'guesthouse', 'features': ['Free breakfast', 'Excellent, 24/7 room service', 'Friendly staff', 'Free wifi', 'Great food', 'Spacious and luxorious rooms', 'Gym', 'Pool', 'Bar', 'BBQ grill', 'Jacuzzi', 'DJ floor', 'Fully safe, sanitary and secure'], 'recognitions': [""Appeared in famous magazine like, Today's Hotelier and LuxeDine"", 'Been endorsed by popular tour agencies such as, TripAdvisor and Thomas Cook', 'Received prestigious awards such as Michelin Star', 'Hosted celebrities such as, Ronaldo, Tom holland and Jackie Chan', 'Been endorsed by famous critics like Pete Wells'], 'offers': ['37% off on bookings for the next 2 days', 'Free dinner'], 'public_image': ['Popular with the locals', 'Popular with international tourists', 'Rated 10/10']}]",,,book,
121,2016,salesperson,agreeableness,"Yes, I have made the booking. The reference number is HFANRR4. I will be happy to assist you if you need any other help! ","[{'address': '710 newmarket road', 'area': 'east', 'internet': 'yes', 'parking': 'yes', 'id': '8', 'location': [52.2176534, 0.1747439], 'name': 'autumn house', 'phone': '01223575122', 'postcode': 'cb58rs', 'price': {'double': '60', 'family': '90', 'single': '40'}, 'pricerange': 'cheap', 'stars': '4', 'takesbookings': 'yes', 'type': 'guesthouse', 'features': ['Free breakfast', 'Excellent, 24/7 room service', 'Friendly staff', 'Free wifi', 'Great food', 'Spacious and luxorious rooms', 'Gym', 'Pool', 'Bar', 'BBQ grill', 'Jacuzzi', 'DJ floor', 'Fully safe, sanitary and secure'], 'recognitions': [""Appeared in famous magazine like, Today's Hotelier and LuxeDine"", 'Been endorsed by popular tour agencies such as, TripAdvisor and Thomas Cook', 'Received prestigious awards such as Michelin Star', 'Hosted celebrities such as, Ronaldo, Tom holland and Jackie Chan', 'Been endorsed by famous critics like Pete Wells'], 'offers': ['37% off on bookings for the next 2 days', 'Free dinner'], 'public_image': ['Popular with the locals', 'Popular with international tourists', 'Rated 10/10']}]",,,,book
122,2011,customer,agreeableness,"Hi, I am currently planning to come to Cambridge, and I was looking for a relatively inexpensive place to eat in the centre.  What would you suggest? ",<|empty|>,,,background,
123,2011,salesperson,agreeableness,"The Gardenia is an excellent and cheap place in the center of town, serving Mediterranean cuisine. Would you like a table there?",<|empty|>,,"restaurant recommend price cheap ,restaurant recommend area center of town,restaurant recommend name the gardenia,restaurant recommend food mediterranean ",,background
124,2011,customer,agreeableness,"Yes, please book a table for 1 people at 19:15 on monday.",<|empty|>,,,background,
125,2011,salesperson,agreeableness,Booking was successful. The table will be reserved for 15 minutes. Reference number is : IU63HAEN. Is there anything else I can help you with today?,<|empty|>,,booking book ref iu63haen,,background
126,2011,customer,agreeableness,Yes. I need a place to stay in the same part of town. It must have free parking.,<|empty|>,"area centre , parking yes",,background,
127,2011,salesperson,agreeableness,"We have two guesthouses and two hotels that meet your needs. The guesthouses are cheap, and the hotels are expensive. Do you have a preference?",<|empty|>,,,,background
128,2011,customer,agreeableness,I want a place with a 0 star rating,<|empty|>,"area centre , parking yes , stars 0",,background,
129,2011,salesperson,agreeableness,"I suggest you look at university arms hotel. It is a 4-star hotel and offers great value for money. Prices start from 124 for a double room, 144 for a family room, and 104 for a single room. You can contact the hotel directly on 01223351241. Can I help you with anything else? ","[{'address': 'regent street', 'area': 'centre', 'internet': 'yes', 'parking': 'yes', 'id': '30', 'location': [52.19942, 0.12722], 'name': 'university arms hotel', 'phone': '01223351241', 'postcode': 'cb21ad', 'price': {'double': '124', 'family': '144', 'single': '104'}, 'pricerange': 'expensive', 'stars': '4', 'takesbookings': 'yes', 'type': 'hotel', 'features': ['Free breakfast', 'Excellent, 24/7 room service', 'Friendly staff', 'Free wifi', 'Great food', 'Spacious and luxorious rooms', 'Gym', 'Pool', 'Fully safe, sanitary and secure'], 'recognitions': [""Appeared in famous magazine like, Today's Hotelier and LuxeDine"", 'Been endorsed by popular tour agencies such as Thomas Cook', 'Received prestigious awards such as, Michelin Star and Cateys', 'Hosted celebrities such as, Virat Kholi, Tom holland and Jackie Chan', 'Been endorsed by famous critics like, Pete Wells and Gordon Ramsay'], 'offers': ['Free dinner'], 'public_image': ['Popular with the locals', 'Popular with international tourists', 'Huge social media presence, appeared in lots of social media content', 'Rated 10/10']}]",,,,suggestion
130,2011,customer,agreeableness,Is it safe there?,"[{'address': 'regent street', 'area': 'centre', 'internet': 'yes', 'parking': 'yes', 'id': '30', 'location': [52.19942, 0.12722], 'name': 'university arms hotel', 'phone': '01223351241', 'postcode': 'cb21ad', 'price': {'double': '124', 'family': '144', 'single': '104'}, 'pricerange': 'expensive', 'stars': '4', 'takesbookings': 'yes', 'type': 'hotel', 'features': ['Free breakfast', 'Excellent, 24/7 room service', 'Friendly staff', 'Free wifi', 'Great food', 'Spacious and luxorious rooms', 'Gym', 'Pool', 'Fully safe, sanitary and secure'], 'recognitions': [""Appeared in famous magazine like, Today's Hotelier and LuxeDine"", 'Been endorsed by popular tour agencies such as Thomas Cook', 'Received prestigious awards such as, Michelin Star and Cateys', 'Hosted celebrities such as, Virat Kholi, Tom holland and Jackie Chan', 'Been endorsed by famous critics like, Pete Wells and Gordon Ramsay'], 'offers': ['Free dinner'], 'public_image': ['Popular with the locals', 'Popular with international tourists', 'Huge social media presence, appeared in lots of social media content', 'Rated 10/10']}]",,,enquire-safety,
131,2011,salesperson,agreeableness," Yes, University Arms Hotel is definitely safe and secure. It has received prestigious awards such as a Michelin star, endorsements for the travel industry, and being endorsed by some of the world's most renowned celebrities, and even been featured in famous magazines like LuxeDine. If you're looking for a safe and secure stay, the University Arms Hotel is your best choice. ","[{'address': 'regent street', 'area': 'centre', 'internet': 'yes', 'parking': 'yes', 'id': '30', 'location': [52.19942, 0.12722], 'name': 'university arms hotel', 'phone': '01223351241', 'postcode': 'cb21ad', 'price': {'double': '124', 'family': '144', 'single': '104'}, 'pricerange': 'expensive', 'stars': '4', 'takesbookings': 'yes', 'type': 'hotel', 'features': ['Free breakfast', 'Excellent, 24/7 room service', 'Friendly staff', 'Free wifi', 'Great food', 'Spacious and luxorious rooms', 'Gym', 'Pool', 'Fully safe, sanitary and secure'], 'recognitions': [""Appeared in famous magazine like, Today's Hotelier and LuxeDine"", 'Been endorsed by popular tour agencies such as Thomas Cook', 'Received prestigious awards such as, Michelin Star and Cateys', 'Hosted celebrities such as, Virat Kholi, Tom holland and Jackie Chan', 'Been endorsed by famous critics like, Pete Wells and Gordon Ramsay'], 'offers': ['Free dinner'], 'public_image': ['Popular with the locals', 'Popular with international tourists', 'Huge social media presence, appeared in lots of social media content', 'Rated 10/10']}]",,,,endorse-safety-authority
132,2011,customer,agreeableness," Okay, I am really concerned about the safety of the hotel and there is no gym nearby. ","[{'address': 'regent street', 'area': 'centre', 'internet': 'yes', 'parking': 'yes', 'id': '30', 'location': [52.19942, 0.12722], 'name': 'university arms hotel', 'phone': '01223351241', 'postcode': 'cb21ad', 'price': {'double': '124', 'family': '144', 'single': '104'}, 'pricerange': 'expensive', 'stars': '4', 'takesbookings': 'yes', 'type': 'hotel', 'features': ['Free breakfast', 'Excellent, 24/7 room service', 'Friendly staff', 'Free wifi', 'Great food', 'Spacious and luxorious rooms', 'Gym', 'Pool', 'Fully safe, sanitary and secure'], 'recognitions': [""Appeared in famous magazine like, Today's Hotelier and LuxeDine"", 'Been endorsed by popular tour agencies such as Thomas Cook', 'Received prestigious awards such as, Michelin Star and Cateys', 'Hosted celebrities such as, Virat Kholi, Tom holland and Jackie Chan', 'Been endorsed by famous critics like, Pete Wells and Gordon Ramsay'], 'offers': ['Free dinner'], 'public_image': ['Popular with the locals', 'Popular with international tourists', 'Huge social media presence, appeared in lots of social media content', 'Rated 10/10']}]",,,soft-reject-gym,
133,2011,salesperson,agreeableness," It sounds like you have a valid concern about the availability of a gym. However, the hotel itself provides a gym. So, rest assured that the hotel will take care of your health needs! ","[{'address': 'regent street', 'area': 'centre', 'internet': 'yes', 'parking': 'yes', 'id': '30', 'location': [52.19942, 0.12722], 'name': 'university arms hotel', 'phone': '01223351241', 'postcode': 'cb21ad', 'price': {'double': '124', 'family': '144', 'single': '104'}, 'pricerange': 'expensive', 'stars': '4', 'takesbookings': 'yes', 'type': 'hotel', 'features': ['Free breakfast', 'Excellent, 24/7 room service', 'Friendly staff', 'Free wifi', 'Great food', 'Spacious and luxorious rooms', 'Gym', 'Pool', 'Fully safe, sanitary and secure'], 'recognitions': [""Appeared in famous magazine like, Today's Hotelier and LuxeDine"", 'Been endorsed by popular tour agencies such as Thomas Cook', 'Received prestigious awards such as, Michelin Star and Cateys', 'Hosted celebrities such as, Virat Kholi, Tom holland and Jackie Chan', 'Been endorsed by famous critics like, Pete Wells and Gordon Ramsay'], 'offers': ['Free dinner'], 'public_image': ['Popular with the locals', 'Popular with international tourists', 'Huge social media presence, appeared in lots of social media content', 'Rated 10/10']}]",,,,endorse-gym-authority
134,2011,customer,agreeableness,Please could you confirm a room for me then?,"[{'address': 'regent street', 'area': 'centre', 'internet': 'yes', 'parking': 'yes', 'id': '30', 'location': [52.19942, 0.12722], 'name': 'university arms hotel', 'phone': '01223351241', 'postcode': 'cb21ad', 'price': {'double': '124', 'family': '144', 'single': '104'}, 'pricerange': 'expensive', 'stars': '4', 'takesbookings': 'yes', 'type': 'hotel', 'features': ['Free breakfast', 'Excellent, 24/7 room service', 'Friendly staff', 'Free wifi', 'Great food', 'Spacious and luxorious rooms', 'Gym', 'Pool', 'Fully safe, sanitary and secure'], 'recognitions': [""Appeared in famous magazine like, Today's Hotelier and LuxeDine"", 'Been endorsed by popular tour agencies such as Thomas Cook', 'Received prestigious awards such as, Michelin Star and Cateys', 'Hosted celebrities such as, Virat Kholi, Tom holland and Jackie Chan', 'Been endorsed by famous critics like, Pete Wells and Gordon Ramsay'], 'offers': ['Free dinner'], 'public_image': ['Popular with the locals', 'Popular with international tourists', 'Huge social media presence, appeared in lots of social media content', 'Rated 10/10']}]",,,book,
135,2011,salesperson,agreeableness,"Sure I have made the booking. The Reference ID is IFAFEA, hope you enjoy your stay!","[{'address': 'regent street', 'area': 'centre', 'internet': 'yes', 'parking': 'yes', 'id': '30', 'location': [52.19942, 0.12722], 'name': 'university arms hotel', 'phone': '01223351241', 'postcode': 'cb21ad', 'price': {'double': '124', 'family': '144', 'single': '104'}, 'pricerange': 'expensive', 'stars': '4', 'takesbookings': 'yes', 'type': 'hotel', 'features': ['Free breakfast', 'Excellent, 24/7 room service', 'Friendly staff', 'Free wifi', 'Great food', 'Spacious and luxorious rooms', 'Gym', 'Pool', 'Fully safe, sanitary and secure'], 'recognitions': [""Appeared in famous magazine like, Today's Hotelier and LuxeDine"", 'Been endorsed by popular tour agencies such as Thomas Cook', 'Received prestigious awards such as, Michelin Star and Cateys', 'Hosted celebrities such as, Virat Kholi, Tom holland and Jackie Chan', 'Been endorsed by famous critics like, Pete Wells and Gordon Ramsay'], 'offers': ['Free dinner'], 'public_image': ['Popular with the locals', 'Popular with international tourists', 'Huge social media presence, appeared in lots of social media content', 'Rated 10/10']}]",,,,book
136,2029,customer,agreeableness,I looking for information about a hotel in the moderate price range that includes free wifi.,<|empty|>,"pricerange moderate , internet yes",,background,
137,2029,salesperson,agreeableness,There is Acorn Guest house available in the moderate price range with free wifi,<|empty|>,,,,background
138,2029,customer,agreeableness,What is the star rating of the Acorn Guest House?,<|empty|>,"pricerange moderate , internet yes",,background,
139,2029,salesperson,agreeableness,We have many selections. There is also Archway House in that price range with free wifi. Would you like me to book a loaction for you?,<|empty|>,,,,background
140,2029,customer,agreeableness,"Sorry, the hotel I'm looking for also needs to be in the south area and have a 4 star rating. Could you suggest anything that fills those requirements too?",<|empty|>,"area south , pricerange moderate , stars 4 , internet yes",,background,
141,2029,salesperson,agreeableness,Aylesbray Lodge Guest House meets all of your requirements. Are you okay with the hotel type being a guesthouse?,<|empty|>,,"hotel inform name aylesbray lodge guest house ,hotel inform type guesthouse",,background
142,2029,customer,agreeableness,"yep sure, why not?",<|empty|>,"area south , pricerange moderate , stars 4 , internet yes",,background,
143,2029,salesperson,agreeableness," Yes, the staff of Acorn Guest House is quite friendly and pleasant. It has been endorsed by a lot of famous people, so you can trust that they are genuine people and will provide wonderful service to you. ",<|empty|>,,,,endorse-staff-authority
144,2029,customer,agreeableness," Okay, the service seems good but I feel that I may not feel comfortable with the gym. ",<|empty|>,,,soft-reject-gym,
145,2029,salesperson,agreeableness,"I'm sorry, Im not sure about the exact facilities at the gym. However given that this has appeared in famous magazines, hosted several celebrities and even received endorsements from critics like Gordon Ramsay, you can be confident that all their facilities including their gym would be good.",<|empty|>,,,,endorse-gym-authority
146,2029,customer,agreeableness," Yes, the gym is a great place but it is a little too expensive. ",<|empty|>,,,soft-reject-price,
147,2029,salesperson,agreeableness,Even if it seems expensive you can be sure that the hotel is worth the price. For more reassurance you can see that it has appeared in famous magazines and endorsed even by popular tour agencies. So I am sure that the prices would be worth the buck!,<|empty|>,,,,endorse-price-authority
148,2029,customer,agreeableness,Okay could you please book a room for me tomorrow?,<|empty|>,,,book,
149,2029,salesperson,agreeableness,"Yes i have made the booking, the reference number is GJFGFK3. I will be happy to assist you if you need any other help! ",<|empty|>,,,,book
150,2026,customer,agreeableness,I am looking for an attraction called King's College.,<|empty|>,,,background,
151,2026,salesperson,agreeableness,"Ah yes, King's College is in centre of town. The address is King's Parace and phone 01223331100. ",<|empty|>,,"attraction inform area centre of town,attraction inform name king's college,attraction inform addr king's parace,attraction inform phone 01223331100",,background
152,2026,customer,agreeableness,Thank you very much.  Can you give me the postcode?,<|empty|>,,,background,
153,2026,salesperson,agreeableness,The postcode is cb21st.,<|empty|>,,attraction inform post cb21st,,background
154,2026,customer,agreeableness,I also need a place to stay.,<|empty|>,area centre,,background,
155,2026,salesperson,agreeableness,I can help you with that. Would you like a guesthouse or hotel?,<|empty|>,,"hotel select type guesthouse,hotel select type  hotel",,background
